author_id,created_at,text,tokens,filtered_tokens,stemmed_text,term,cluster
rzkr,2025-04-11T06:50:44.000Z,"HAHAH  yg dia tida tau, siapa tau si crush2 ini mau jadi researcher di yapan atau mana, bisa jadi sarana kaburajadulu ","HAHAH, yg, dia, tida, tau, ,, siapa, tau, si, crush2, ini, mau, jadi, researcher, di, yapan, atau, mana, ,, bisa, jadi, sarana, kaburajadulu","HAHAH, yg, tida, tau, ,, tau, si, crush2, researcher, yapan, ,, sarana, kaburajadulu",hahah yg dia tida tau siapa tau si crush2 ini mau jadi researcher di yapan atau mana bisa jadi sarana kaburajadulu,"hahah,yg,dia,tida,tau,siapa,tau,si,crush2,ini,mau,jadi,researcher,di,yapan,atau,mana,bisa,jadi,sarana,kaburajadulu",0
krimtigakali,2025-04-11T06:48:52.000Z,udh siap banget buat #KaburAjaDulu,"udh, siap, banget, buat, #, KaburAjaDulu","udh, banget, #, KaburAjaDulu",udh siap banget buat kaburajadulu,"udh,siap,banget,buat,kaburajadulu",1
JoseAndre89,2025-04-11T06:41:27.000Z,berarti warga sana jg gak hepi dong ya pada kaburajadulu lah yg di sini malah mau ke sana,"berarti, warga, sana, jg, gak, hepi, dong, ya, pada, kaburajadulu, lah, yg, di, sini, malah, mau, ke, sana","warga, jg, gak, hepi, ya, kaburajadulu, yg",arti warga sana jg gak hepi dong ya pada kaburajadulu lah yg di sini malah mau ke sana,"arti,warga,sana,jg,gak,hepi,dong,ya,pada,kaburajadulu,lah,yg,di,sini,malah,mau,ke,sana",0
seijisuzuki6,2025-04-11T06:28:53.000Z,Maling Bayar Polisi  Penjahat Juga Bayar Polisi  Indonesia Bubar & Digantikan Oleh Pulau Mulyono Sebagai Pulau Teroris.   #KaburAjaDulu  #IndonesiaBubar,"Maling, Bayar, Polisi, Penjahat, Juga, Bayar, Polisi, Indonesia, Bubar, &, Digantikan, Oleh, Pulau, Mulyono, Sebagai, Pulau, Teroris, ., #, KaburAjaDulu, #, IndonesiaBubar","Maling, Bayar, Polisi, Penjahat, Bayar, Polisi, Indonesia, Bubar, &, Digantikan, Pulau, Mulyono, Pulau, Teroris, ., #, KaburAjaDulu, #, IndonesiaBubar",maling bayar polisi jahat juga bayar polisi indonesia bubar ganti oleh pulau mulyono bagai pulau teroris kaburajadulu indonesiabubar,"maling,bayar,polisi,jahat,juga,bayar,polisi,indonesia,bubar,ganti,oleh,pulau,mulyono,bagai,pulau,teroris,kaburajadulu,indonesiabubar",1
lab45_,2025-04-11T06:28:23.000Z,"Dialog seru antara  @akbarfaizal68 , Reyhan Noor (Koordinator Analis LAB 45) dan  @gunlebang  (Analis Utama Politik Keamanan LAB 45) di podcast ini membahas secara mendalam dinamika di balik “#KABURAJADULU | KOMUNIKASI BURUK & PEMIKIRAN ANALOG PEMERINTAH BIKIN RESAH” Jangan lewatkan","Dialog, seru, antara, @, akbarfaizal68, ,, Reyhan, Noor, (, Koordinator, Analis, LAB, 45, ), dan, @, gunlebang, (, Analis, Utama, Politik, Keamanan, LAB, 45, ), di, podcast, ini, membahas, secara, mendalam, dinamika, di, balik, “, #, KABURAJADULU, |, KOMUNIKASI, BURUK, &, PEMIKIRAN, ANALOG, PEMERINTAH, BIKIN, RESAH, ”, Jangan, lewatkan","Dialog, seru, @, akbarfaizal68, ,, Reyhan, Noor, (, Koordinator, Analis, LAB, 45, ), @, gunlebang, (, Analis, Utama, Politik, Keamanan, LAB, 45, ), podcast, membahas, mendalam, dinamika, “, #, KABURAJADULU, |, KOMUNIKASI, BURUK, &, PEMIKIRAN, ANALOG, PEMERINTAH, BIKIN, RESAH, ”, lewatkan",dialog seru antara akbarfaizal68 reyhan noor koordinator analis lab 45 dan gunlebang analis utama politik aman lab 45 di podcast ini bahas cara dalam dinamika di balik kaburajadulu komunikasi buruk pikir analog perintah bikin resah jangan lewat,"dialog,seru,antara,akbarfaizal68,reyhan,noor,koordinator,analis,lab,45,dan,gunlebang,analis,utama,politik,aman,lab,45,di,podcast,ini,bahas,cara,dalam,dinamika,di,balik,kaburajadulu,komunikasi,buruk,pikir,analog,perintah,bikin,resah,jangan,lewat",0
tangerinecourt,2025-04-11T06:28:19.000Z,YAS HANA btw dai cari kerjaan baru asap ya yg sustainable.. preferably yg bisa kaburajadulu ,"YAS, HANA, btw, dai, cari, kerjaan, baru, asap, ya, yg, sustainable, .., preferably, yg, bisa, kaburajadulu","YAS, HANA, btw, dai, cari, kerjaan, asap, ya, yg, sustainable, .., preferably, yg, kaburajadulu",yas hana btw dai cari kerja baru asap ya yg sustainable preferably yg bisa kaburajadulu,"yas,hana,btw,dai,cari,kerja,baru,asap,ya,yg,sustainable,preferably,yg,bisa,kaburajadulu",0
inertiamomentio,2025-04-11T06:06:34.000Z,kalo nginepnya 10 taun dhir? trus pake hastagh #KaburAjaDulu,"kalo, nginepnya, 10, taun, dhir, ?, trus, pake, hastagh, #, KaburAjaDulu","kalo, nginepnya, 10, taun, dhir, ?, trus, pake, hastagh, #, KaburAjaDulu",kalo nginepnya 10 taun dhir trus pake hastagh kaburajadulu,"kalo,nginepnya,10,taun,dhir,trus,pake,hastagh,kaburajadulu",1
dillanhaddad,2025-04-11T05:49:00.000Z,healing tipis before #kaburajadulu,"healing, tipis, before, #, kaburajadulu","healing, tipis, before, #, kaburajadulu",healing tipis before kaburajadulu,"healing,tipis,before,kaburajadulu",1
lunneau,2025-04-11T05:48:11.000Z,emang harusnya kita #KaburAjaDulu,"emang, harusnya, kita, #, KaburAjaDulu","emang, #, KaburAjaDulu",emang harus kita kaburajadulu,"emang,harus,kita,kaburajadulu",1
hal4nz,2025-04-11T05:36:39.000Z,"Jadi kesimpulannya, biarkan warga Gaza tetap di Palestina dan mempertahankan Palestina, jangan disuruh #KaburAjaDulu kesini  Begitu juga dengan warga negara lain, kita motivasi mereka untuk stay di negara nya masing-masing","Jadi, kesimpulannya, ,, biarkan, warga, Gaza, tetap, di, Palestina, dan, mempertahankan, Palestina, ,, jangan, disuruh, #, KaburAjaDulu, kesini, Begitu, juga, dengan, warga, negara, lain, ,, kita, motivasi, mereka, untuk, stay, di, negara, nya, masing-masing","kesimpulannya, ,, biarkan, warga, Gaza, Palestina, mempertahankan, Palestina, ,, disuruh, #, KaburAjaDulu, kesini, warga, negara, ,, motivasi, stay, negara, nya",jadi simpul biar warga gaza tetap di palestina dan tahan palestina jangan suruh kaburajadulu kesini begitu juga dengan warga negara lain kita motivasi mereka untuk stay di negara nya masing-masing,"jadi,simpul,biar,warga,gaza,tetap,di,palestina,dan,tahan,palestina,jangan,suruh,kaburajadulu,kesini,begitu,juga,dengan,warga,negara,lain,kita,motivasi,mereka,untuk,stay,di,negara,nya,masing-masing",0
4_00L,2025-04-11T05:14:30.000Z,trus kita KaburAjaDulu ,"trus, kita, KaburAjaDulu","trus, KaburAjaDulu",trus kita kaburajadulu,"trus,kita,kaburajadulu",1
BGPATRA,2025-04-11T04:57:23.000Z,Parafal Headshot BocilFF diabisi #partaikorupsi #kaburajadulu #csrank https://youtu.be/NGVbkcstW9I?si=ASTAnbKCjkJCf2G3… lewat  @YouTube,"Parafal, Headshot, BocilFF, diabisi, #, partaikorupsi, #, kaburajadulu, #, csrank, https, :, //youtu.be/NGVbkcstW9I, ?, si=ASTAnbKCjkJCf2G3…, lewat, @, YouTube","Parafal, Headshot, BocilFF, diabisi, #, partaikorupsi, #, kaburajadulu, #, csrank, https, :, //youtu.be/NGVbkcstW9I, ?, si=ASTAnbKCjkJCf2G3…, @, YouTube",parafal headshot bocilff abis partaikorupsi kaburajadulu csrank https youtu be ngvbkcstw9i si astanbkcjkjcf2g3 lewat youtube,"parafal,headshot,bocilff,abis,partaikorupsi,kaburajadulu,csrank,https,youtu,be,ngvbkcstw9i,si,astanbkcjkjcf2g3,lewat,youtube",1
sxnoophy,2025-04-11T04:48:41.000Z,/kaburajadulu,/kaburajadulu,/kaburajadulu,kaburajadulu,kaburajadulu,1
KimiaHendra,2025-04-11T04:44:52.000Z,Pelaku pelanggar HAM bicara HAM. #KaburAjaDulu ke yordan,"Pelaku, pelanggar, HAM, bicara, HAM, ., #, KaburAjaDulu, ke, yordan","Pelaku, pelanggar, HAM, bicara, HAM, ., #, KaburAjaDulu, yordan",laku langgar ham bicara ham kaburajadulu ke yordan,"laku,langgar,ham,bicara,ham,kaburajadulu,ke,yordan",0
tvr_parlemen,2025-04-11T04:44:42.000Z,MAU #KABURAJADULU KE MANA PUN TETAP HARUS LEGAL!! - Sudut Dengar Parlemen,"MAU, #, KABURAJADULU, KE, MANA, PUN, TETAP, HARUS, LEGAL, !, !, -, Sudut, Dengar, Parlemen","#, KABURAJADULU, LEGAL, !, !, -, Sudut, Dengar, Parlemen",mau kaburajadulu ke mana pun tetap harus legal - sudut dengar parlemen,"mau,kaburajadulu,ke,mana,pun,tetap,harus,legal,-,sudut,dengar,parlemen",0
HadiJuventino86,2025-04-11T04:34:46.000Z,"Kalau niatnyq #KaburAjaDulu yang gas kan. Gaji nomer dua dulu, kalau sudah dpt experience diluar negeri, biasanya kedepannya mudah untuk next job nya. Yang penting kerja luar negeri dulu aja.","Kalau, niatnyq, #, KaburAjaDulu, yang, gas, kan., Gaji, nomer, dua, dulu, ,, kalau, sudah, dpt, experience, diluar, negeri, ,, biasanya, kedepannya, mudah, untuk, next, job, nya, ., Yang, penting, kerja, luar, negeri, dulu, aja, .","niatnyq, #, KaburAjaDulu, gas, kan., Gaji, nomer, ,, dpt, experience, diluar, negeri, ,, kedepannya, mudah, next, job, nya, ., kerja, negeri, aja, .",kalau niatnyq kaburajadulu yang gas kan gaji nomer dua dulu kalau sudah dpt experience luar negeri biasa depan mudah untuk next job nya yang penting kerja luar negeri dulu aja,"kalau,niatnyq,kaburajadulu,yang,gas,kan,gaji,nomer,dua,dulu,kalau,sudah,dpt,experience,luar,negeri,biasa,depan,mudah,untuk,next,job,nya,yang,penting,kerja,luar,negeri,dulu,aja",0
kafir_introver,2025-04-11T04:25:54.000Z,"kerenn, stay safee lailll   mutual pertama yang berhasil #KaburAjaDulu kayaknya","kerenn, ,, stay, safee, lailll, mutual, pertama, yang, berhasil, #, KaburAjaDulu, kayaknya","kerenn, ,, stay, safee, lailll, mutual, berhasil, #, KaburAjaDulu, kayaknya",kerenn stay safee lailll mutual pertama yang hasil kaburajadulu kayak,"kerenn,stay,safee,lailll,mutual,pertama,yang,hasil,kaburajadulu,kayak",1
2304dotorii,2025-04-11T03:46:32.000Z,Bang menang buka loker gak? Gua mau #KaburAjaDulu ke thai kerja jadi pegawai lu bang tolong bgttt ini mah   @winmetawin,"Bang, menang, buka, loker, gak, ?, Gua, mau, #, KaburAjaDulu, ke, thai, kerja, jadi, pegawai, lu, bang, tolong, bgttt, ini, mah, @, winmetawin","Bang, menang, buka, loker, gak, ?, Gua, #, KaburAjaDulu, thai, kerja, pegawai, lu, bang, tolong, bgttt, mah, @, winmetawin",bang menang buka loker gak gua mau kaburajadulu ke thai kerja jadi pegawai lu bang tolong bgttt ini mah winmetawin,"bang,menang,buka,loker,gak,gua,mau,kaburajadulu,ke,thai,kerja,jadi,pegawai,lu,bang,tolong,bgttt,ini,mah,winmetawin",0
lilbeannyyy,2025-04-11T03:30:09.000Z,"Haloo, sisa buku A2 Netzwerk Neu, yang mau langsung ambil dehh.... 70k ambil 2 langsung dm, bisa Oren, dari Jakarta  #wtb #ausbildung #fsj #KaburAjaDulu #zonauang #zonajajan","Haloo, ,, sisa, buku, A2, Netzwerk, Neu, ,, yang, mau, langsung, ambil, dehh, ...., 70k, ambil, 2, langsung, dm, ,, bisa, Oren, ,, dari, Jakarta, #, wtb, #, ausbildung, #, fsj, #, KaburAjaDulu, #, zonauang, #, zonajajan","Haloo, ,, sisa, buku, A2, Netzwerk, Neu, ,, langsung, ambil, dehh, ...., 70k, ambil, 2, langsung, dm, ,, Oren, ,, Jakarta, #, wtb, #, ausbildung, #, fsj, #, KaburAjaDulu, #, zonauang, #, zonajajan",haloo sisa buku a2 netzwerk neu yang mau langsung ambil dehh 70k ambil 2 langsung dm bisa oren dari jakarta wtb ausbildung fsj kaburajadulu zonauang zonajajan,"haloo,sisa,buku,a2,netzwerk,neu,yang,mau,langsung,ambil,dehh,70k,ambil,2,langsung,dm,bisa,oren,dari,jakarta,wtb,ausbildung,fsj,kaburajadulu,zonauang,zonajajan",0
sarangryu_,2025-04-11T03:29:04.000Z,"morning, nenek! hng .... agak gelap yh  tapi aku pengen #kaburajadulu. jadi jangan plis?","morning, ,, nenek, !, hng, ...., agak, gelap, yh, tapi, aku, pengen, #, kaburajadulu, ., jadi, jangan, plis, ?","morning, ,, nenek, !, hng, ...., gelap, yh, pengen, #, kaburajadulu, ., plis, ?",morning nenek hng agak gelap yh tapi aku ken kaburajadulu jadi jangan plis,"morning,nenek,hng,agak,gelap,yh,tapi,aku,ken,kaburajadulu,jadi,jangan,plis",0
boyan,2025-04-11T03:11:04.000Z,ngomongin siber sama gen. analog emg dagelan >> #KABURAJADULU | KOMUNIKASI BURUK & PEMIKIRAN ANALOG PEMERINTAH BIKIN RESAH https://youtu.be/ndv9c2HzVmM?si=wGiwnfKEj_cn3lhr… via  @YouTube,"ngomongin, siber, sama, gen., analog, emg, dagelan, >, >, #, KABURAJADULU, |, KOMUNIKASI, BURUK, &, PEMIKIRAN, ANALOG, PEMERINTAH, BIKIN, RESAH, https, :, //youtu.be/ndv9c2HzVmM, ?, si=wGiwnfKEj_cn3lhr…, via, @, YouTube","ngomongin, siber, gen., analog, emg, dagelan, >, >, #, KABURAJADULU, |, KOMUNIKASI, BURUK, &, PEMIKIRAN, ANALOG, PEMERINTAH, BIKIN, RESAH, https, :, //youtu.be/ndv9c2HzVmM, ?, si=wGiwnfKEj_cn3lhr…, via, @, YouTube",ngomongin siber sama gen analog emg dagel kaburajadulu komunikasi buruk pikir analog perintah bikin resah https youtu be ndv9c2hzvmm si wgiwnfkej cn3lhr via youtube,"ngomongin,siber,sama,gen,analog,emg,dagel,kaburajadulu,komunikasi,buruk,pikir,analog,perintah,bikin,resah,https,youtu,be,ndv9c2hzvmm,si,wgiwnfkej,cn3lhr,via,youtube",0
Aamediketu,2025-04-11T03:06:59.000Z,Kaburajadulu,Kaburajadulu,Kaburajadulu,kaburajadulu,kaburajadulu,1
sedihmawat45830,2025-04-11T02:53:53.000Z,XM8 Killstreak Party #kaburajadulu #partaikorupsi,"XM8, Killstreak, Party, #, kaburajadulu, #, partaikorupsi","XM8, Killstreak, Party, #, kaburajadulu, #, partaikorupsi",xm8 killstreak party kaburajadulu partaikorupsi,"xm8,killstreak,party,kaburajadulu,partaikorupsi",1
Yangterdalamm,2025-04-11T02:50:01.000Z,info #kaburajadulu suram bgt tinggal di indo,"info, #, kaburajadulu, suram, bgt, tinggal, di, indo","info, #, kaburajadulu, suram, bgt, tinggal, indo",info kaburajadulu suram bgt tinggal di indo,"info,kaburajadulu,suram,bgt,tinggal,di,indo",0
truthspace_,2025-04-11T01:01:16.000Z,"Bukan hanya di indo ya sulit cari kerja. SELURUH DUNIA.  Kalau  imigran  #KaburAjaDulu mah dimudahin cari kerja disana, warga aslinya malah dibikin sulit  @wannafigh","Bukan, hanya, di, indo, ya, sulit, cari, kerja, ., SELURUH, DUNIA, ., Kalau, imigran, #, KaburAjaDulu, mah, dimudahin, cari, kerja, disana, ,, warga, aslinya, malah, dibikin, sulit, @, wannafigh","indo, ya, sulit, cari, kerja, ., DUNIA, ., imigran, #, KaburAjaDulu, mah, dimudahin, cari, kerja, disana, ,, warga, aslinya, dibikin, sulit, @, wannafigh",bukan hanya di indo ya sulit cari kerja seluruh dunia kalau imigran kaburajadulu mah dimudahin cari kerja sana warga asli malah bikin sulit wannafigh,"bukan,hanya,di,indo,ya,sulit,cari,kerja,seluruh,dunia,kalau,imigran,kaburajadulu,mah,dimudahin,cari,kerja,sana,warga,asli,malah,bikin,sulit,wannafigh",0
Faldylouis_,2025-04-11T00:50:46.000Z,Udah bang udah jangan di ulti hahahaha. Alesannya kalo gasalah karna dia dituduh makanya mending #kaburajadulu,"Udah, bang, udah, jangan, di, ulti, hahahaha, ., Alesannya, kalo, gasalah, karna, dia, dituduh, makanya, mending, #, kaburajadulu","Udah, bang, udah, ulti, hahahaha, ., Alesannya, kalo, gasalah, karna, dituduh, mending, #, kaburajadulu",udah bang udah jangan di ulti hahahaha alesannya kalo gasalah karna dia tuduh makanya mending kaburajadulu,"udah,bang,udah,jangan,di,ulti,hahahaha,alesannya,kalo,gasalah,karna,dia,tuduh,makanya,mending,kaburajadulu",0
orreboss,2025-04-11T00:21:32.000Z,#KaburAjaDulu adalah fase & step terakhirku untuk berkembang & berkarir di negeri orang u/ menjadi lebih baik lagi & pengen segera bantu orang tua dan orang2 yg suka nolong aq secara pribadi.,"#, KaburAjaDulu, adalah, fase, &, step, terakhirku, untuk, berkembang, &, berkarir, di, negeri, orang, u/, menjadi, lebih, baik, lagi, &, pengen, segera, bantu, orang, tua, dan, orang2, yg, suka, nolong, aq, secara, pribadi, .","#, KaburAjaDulu, fase, &, step, terakhirku, berkembang, &, berkarir, negeri, orang, u/, &, pengen, bantu, orang, tua, orang2, yg, suka, nolong, aq, pribadi, .",kaburajadulu adalah fase step akhir untuk kembang berkarir di negeri orang u jadi lebih baik lagi ken segera bantu orang tua dan orang2 yg suka nolong aq cara pribadi,"kaburajadulu,adalah,fase,step,akhir,untuk,kembang,berkarir,di,negeri,orang,u,jadi,lebih,baik,lagi,ken,segera,bantu,orang,tua,dan,orang2,yg,suka,nolong,aq,cara,pribadi",0
roy1alien,2025-04-11T00:18:18.000Z,Maksudnya tadi malam saya bermimpi #KaburAjaDulu keluar negeri,"Maksudnya, tadi, malam, saya, bermimpi, #, KaburAjaDulu, keluar, negeri","Maksudnya, malam, bermimpi, #, KaburAjaDulu, negeri",maksud tadi malam saya mimpi kaburajadulu keluar negeri,"maksud,tadi,malam,saya,mimpi,kaburajadulu,keluar,negeri",1
d6yepposo,2025-04-11T00:10:36.000Z,"sender aku gabisa kasih masukan terkait karir karna belum berpengalaman, tapi kalau keinginan #kaburajadulu udah sekuat itu pasti ga bimbang, saran aku emang stay dulu sambil siapin hal yg lain buat #kaburajadulu biar kedepan kalo ada offer lain udah beneran mateng dan siap","sender, aku, gabisa, kasih, masukan, terkait, karir, karna, belum, berpengalaman, ,, tapi, kalau, keinginan, #, kaburajadulu, udah, sekuat, itu, pasti, ga, bimbang, ,, saran, aku, emang, stay, dulu, sambil, siapin, hal, yg, lain, buat, #, kaburajadulu, biar, kedepan, kalo, ada, offer, lain, udah, beneran, mateng, dan, siap","sender, gabisa, kasih, masukan, terkait, karir, karna, berpengalaman, ,, #, kaburajadulu, udah, sekuat, ga, bimbang, ,, saran, emang, stay, siapin, yg, #, kaburajadulu, biar, kedepan, kalo, offer, udah, beneran, mateng",sender aku gabisa kasih masuk kait karir karna belum alam tapi kalau ingin kaburajadulu udah kuat itu pasti ga bimbang saran aku emang stay dulu sambil siapin hal yg lain buat kaburajadulu biar depan kalo ada offer lain udah beneran mateng dan siap,"sender,aku,gabisa,kasih,masuk,kait,karir,karna,belum,alam,tapi,kalau,ingin,kaburajadulu,udah,kuat,itu,pasti,ga,bimbang,saran,aku,emang,stay,dulu,sambil,siapin,hal,yg,lain,buat,kaburajadulu,biar,depan,kalo,ada,offer,lain,udah,beneran,mateng,dan,siap",0
EkoPurwanto001,2025-04-11T00:09:41.000Z,Alhamdulillah.. bisa sebagai opsi #KaburAjaDulu ya Pak? ,"Alhamdulillah, .., bisa, sebagai, opsi, #, KaburAjaDulu, ya, Pak, ?","Alhamdulillah, .., opsi, #, KaburAjaDulu, ya, ?",alhamdulillah bisa bagai opsi kaburajadulu ya pak,"alhamdulillah,bisa,bagai,opsi,kaburajadulu,ya,pak",1
hyedyoon,2025-04-11T00:05:36.000Z,#KaburAjaDulu,"#, KaburAjaDulu","#, KaburAjaDulu",kaburajadulu,kaburajadulu,1
phsyco_n,2025-04-10T23:51:02.000Z,Aakk pgn cpt2 lulus trs #KaburAjaDulu ditengah2 chaos nya negara ini,"Aakk, pgn, cpt2, lulus, trs, #, KaburAjaDulu, ditengah2, chaos, nya, negara, ini","Aakk, pgn, cpt2, lulus, trs, #, KaburAjaDulu, ditengah2, chaos, nya, negara",aakk pgn cpt2 lulus trs kaburajadulu ditengah2 chaos nya negara ini,"aakk,pgn,cpt2,lulus,trs,kaburajadulu,ditengah2,chaos,nya,negara,ini",1
dina_ramay,2025-04-10T23:50:25.000Z,Nggak semua lari itu pengecut. Kadang kita butuh #KaburAjaDulu demi waras. ,"Nggak, semua, lari, itu, pengecut, ., Kadang, kita, butuh, #, KaburAjaDulu, demi, waras, .","Nggak, lari, pengecut, ., Kadang, butuh, #, KaburAjaDulu, waras, .",nggak semua lari itu kecut kadang kita butuh kaburajadulu demi waras,"nggak,semua,lari,itu,kecut,kadang,kita,butuh,kaburajadulu,demi,waras",1
GloriaC01107579,2025-04-10T23:36:44.000Z,https://indianapolisstar-in.newsmemory.com/?publink=162564c09_134f94e… kaburajadulu,"https, :, //indianapolisstar-in.newsmemory.com/, ?, publink=162564c09_134f94e…, kaburajadulu","https, :, //indianapolisstar-in.newsmemory.com/, ?, publink=162564c09_134f94e…, kaburajadulu",https indianapolisstar-in newsmemory com publink 162564c09 134f94e kaburajadulu,"https,indianapolisstar-in,newsmemory,com,publink,162564c09,134f94e,kaburajadulu",1
Kralicefaran,2025-04-10T23:24:38.000Z,"Bayaran lumayan itu kalau di indo keknya emang dari pemerintah? Tools peta+ pinter analisis. Belum nyari² untuk *kaburajadulu/ global.   Terkadang, mau belajar/ sharing konten data beginian bingung juga. Karna kebanyakan data private dapur gov/perusahaan semua ","Bayaran, lumayan, itu, kalau, di, indo, keknya, emang, dari, pemerintah, ?, Tools, peta+, pinter, analisis, ., Belum, nyari², untuk, *, kaburajadulu/, global, ., Terkadang, ,, mau, belajar/, sharing, konten, data, beginian, bingung, juga, ., Karna, kebanyakan, data, private, dapur, gov/perusahaan, semua","Bayaran, lumayan, indo, keknya, emang, pemerintah, ?, Tools, peta+, pinter, analisis, ., nyari², *, kaburajadulu/, global, ., Terkadang, ,, belajar/, sharing, konten, data, bingung, ., Karna, kebanyakan, data, private, dapur, gov/perusahaan",bayar lumayan itu kalau di indo kek emang dari perintah tools peta pinter analisis belum nyari untuk kaburajadulu global terkadang mau ajar sharing konten data begini bingung juga karna banyak data private dapur gov usaha semua,"bayar,lumayan,itu,kalau,di,indo,kek,emang,dari,perintah,tools,peta,pinter,analisis,belum,nyari,untuk,kaburajadulu,global,terkadang,mau,ajar,sharing,konten,data,begini,bingung,juga,karna,banyak,data,private,dapur,gov,usaha,semua",0
JokoKusnandi92,2025-04-10T23:20:21.000Z,Selamat pagi dunia Semoga hari ini tetap masih semangat Tarif impor ekspor sedang panas akibay tariff reciprocal donal Trump  #KaburAjaDulu #TariffWar #ReciprocalTariffs,"Selamat, pagi, dunia, Semoga, hari, ini, tetap, masih, semangat, Tarif, impor, ekspor, sedang, panas, akibay, tariff, reciprocal, donal, Trump, #, KaburAjaDulu, #, TariffWar, #, ReciprocalTariffs","Selamat, pagi, dunia, Semoga, semangat, Tarif, impor, ekspor, panas, akibay, tariff, reciprocal, donal, Trump, #, KaburAjaDulu, #, TariffWar, #, ReciprocalTariffs",selamat pagi dunia moga hari ini tetap masih semangat tarif impor ekspor sedang panas akibay tariff reciprocal donal trump kaburajadulu tariffwar reciprocaltariffs,"selamat,pagi,dunia,moga,hari,ini,tetap,masih,semangat,tarif,impor,ekspor,sedang,panas,akibay,tariff,reciprocal,donal,trump,kaburajadulu,tariffwar,reciprocaltariffs",1
saturngvrl,2025-04-10T23:09:54.000Z,wkkw aduh malu lagi aku kalo keinget   HAYUKKK!! semoga betulan bisa ya kita # kaburajadulu ,"wkkw, aduh, malu, lagi, aku, kalo, keinget, HAYUKKK, !, !, semoga, betulan, bisa, ya, kita, #, kaburajadulu","wkkw, aduh, malu, kalo, keinget, HAYUKKK, !, !, semoga, betulan, ya, #, kaburajadulu",wkkw aduh malu lagi aku kalo keinget hayukkk moga betul bisa ya kita kaburajadulu,"wkkw,aduh,malu,lagi,aku,kalo,keinget,hayukkk,moga,betul,bisa,ya,kita,kaburajadulu",1
saturngvrl,2025-04-10T22:55:16.000Z,happy birthday gabgabbb!!  doanya kayak yang kemarin ya (+ semoga ada kesempatan buat ikut tagar kaburajadulu) ,"happy, birthday, gabgabbb, !, !, doanya, kayak, yang, kemarin, ya, (, +, semoga, ada, kesempatan, buat, ikut, tagar, kaburajadulu, )","happy, birthday, gabgabbb, !, !, doanya, kayak, kemarin, ya, (, +, semoga, kesempatan, tagar, kaburajadulu, )",happy birthday gabgabbb doa kayak yang kemarin ya moga ada sempat buat ikut tagar kaburajadulu,"happy,birthday,gabgabbb,doa,kayak,yang,kemarin,ya,moga,ada,sempat,buat,ikut,tagar,kaburajadulu",0
roy1alien,2025-04-10T22:43:59.000Z,Mimpi #KaburAjaDulu keluar negeri,"Mimpi, #, KaburAjaDulu, keluar, negeri","Mimpi, #, KaburAjaDulu, negeri",mimpi kaburajadulu keluar negeri,"mimpi,kaburajadulu,keluar,negeri",1
AngelChai60087,2025-04-10T22:41:15.000Z,Gila... modal kecil hasil gede? Essebet emang gak main-main!  #KaburAjaDulu #KimSooHyun #danakaget #No12 #Kerasa #Dafa #KingIndo #Gaza #Adil #Gempa #Onana #indomaret #quizserumaya,"Gila, ..., modal, kecil, hasil, gede, ?, Essebet, emang, gak, main-main, !, #, KaburAjaDulu, #, KimSooHyun, #, danakaget, #, No12, #, Kerasa, #, Dafa, #, KingIndo, #, Gaza, #, Adil, #, Gempa, #, Onana, #, indomaret, #, quizserumaya","Gila, ..., modal, hasil, gede, ?, Essebet, emang, gak, main-main, !, #, KaburAjaDulu, #, KimSooHyun, #, danakaget, #, No12, #, Kerasa, #, Dafa, #, KingIndo, #, Gaza, #, Adil, #, Gempa, #, Onana, #, indomaret, #, quizserumaya",gila modal kecil hasil gede essebet emang gak main kaburajadulu kimsoohyun danakaget no12 rasa dafa kingindo gaza adil gempa onana indomaret quizserumaya,"gila,modal,kecil,hasil,gede,essebet,emang,gak,main,kaburajadulu,kimsoohyun,danakaget,no12,rasa,dafa,kingindo,gaza,adil,gempa,onana,indomaret,quizserumaya",0
saturngvrl,2025-04-10T23:09:54.000Z,wkkw aduh malu lagi aku kalo keinget   HAYUKKK!! semoga betulan bisa ya kita # kaburajadulu ,"wkkw, aduh, malu, lagi, aku, kalo, keinget, HAYUKKK, !, !, semoga, betulan, bisa, ya, kita, #, kaburajadulu","wkkw, aduh, malu, kalo, keinget, HAYUKKK, !, !, semoga, betulan, ya, #, kaburajadulu",wkkw aduh malu lagi aku kalo keinget hayukkk moga betul bisa ya kita kaburajadulu,"wkkw,aduh,malu,lagi,aku,kalo,keinget,hayukkk,moga,betul,bisa,ya,kita,kaburajadulu",1
saturngvrl,2025-04-10T22:55:16.000Z,happy birthday gabgabbb!!  doanya kayak yang kemarin ya (+ semoga ada kesempatan buat ikut tagar kaburajadulu) ,"happy, birthday, gabgabbb, !, !, doanya, kayak, yang, kemarin, ya, (, +, semoga, ada, kesempatan, buat, ikut, tagar, kaburajadulu, )","happy, birthday, gabgabbb, !, !, doanya, kayak, kemarin, ya, (, +, semoga, kesempatan, tagar, kaburajadulu, )",happy birthday gabgabbb doa kayak yang kemarin ya moga ada sempat buat ikut tagar kaburajadulu,"happy,birthday,gabgabbb,doa,kayak,yang,kemarin,ya,moga,ada,sempat,buat,ikut,tagar,kaburajadulu",0
roy1alien,2025-04-10T22:43:59.000Z,Mimpi #KaburAjaDulu keluar negeri,"Mimpi, #, KaburAjaDulu, keluar, negeri","Mimpi, #, KaburAjaDulu, negeri",mimpi kaburajadulu keluar negeri,"mimpi,kaburajadulu,keluar,negeri",1
AngelChai60087,2025-04-10T22:41:15.000Z,Gila... modal kecil hasil gede? Essebet emang gak main-main!  #KaburAjaDulu #KimSooHyun #danakaget #No12 #Kerasa #Dafa #KingIndo #Gaza #Adil #Gempa #Onana #indomaret #quizserumaya,"Gila, ..., modal, kecil, hasil, gede, ?, Essebet, emang, gak, main-main, !, #, KaburAjaDulu, #, KimSooHyun, #, danakaget, #, No12, #, Kerasa, #, Dafa, #, KingIndo, #, Gaza, #, Adil, #, Gempa, #, Onana, #, indomaret, #, quizserumaya","Gila, ..., modal, hasil, gede, ?, Essebet, emang, gak, main-main, !, #, KaburAjaDulu, #, KimSooHyun, #, danakaget, #, No12, #, Kerasa, #, Dafa, #, KingIndo, #, Gaza, #, Adil, #, Gempa, #, Onana, #, indomaret, #, quizserumaya",gila modal kecil hasil gede essebet emang gak main kaburajadulu kimsoohyun danakaget no12 rasa dafa kingindo gaza adil gempa onana indomaret quizserumaya,"gila,modal,kecil,hasil,gede,essebet,emang,gak,main,kaburajadulu,kimsoohyun,danakaget,no12,rasa,dafa,kingindo,gaza,adil,gempa,onana,indomaret,quizserumaya",0
hynjiwn,2025-04-10T22:17:35.000Z,kaburajadulu,kaburajadulu,kaburajadulu,kaburajadulu,kaburajadulu,1
