author_id,created_at,text,tokens,filtered_tokens,stemmed_text,term,cluster
KaburAjaDulu,2025-02-14T01:31:59.000Z,"mau bikin pabrik, regulasi gak jelas, minim infra dan birokrasi ribet mau bikin warung, dipalakin ormas mau jadi pengajar/pendidik, gajinya culun mau kerja informal karena minim akses, digaruk Pol PP mau jadi pegawai, pabrik dan PT sedikit (lihat poin 1)  #KaburAjaDulu","mau, bikin, pabrik, ,, regulasi, gak, jelas, ,, minim, infra, dan, birokrasi, ribet, mau, bikin, warung, ,, dipalakin, ormas, mau, jadi, pengajar/pendidik, ,, gajinya, culun, mau, kerja, informal, karena, minim, akses, ,, digaruk, Pol, PP, mau, jadi, pegawai, ,, pabrik, dan, PT, sedikit, (, lihat, poin, 1, ), #, KaburAjaDulu","bikin, pabrik, ,, regulasi, gak, ,, minim, infra, birokrasi, ribet, bikin, warung, ,, dipalakin, ormas, pengajar/pendidik, ,, gajinya, culun, kerja, informal, minim, akses, ,, digaruk, Pol, PP, pegawai, ,, pabrik, PT, (, lihat, poin, 1, ), #, KaburAjaDulu",mau bikin pabrik regulasi gak jelas minim infra dan birokrasi ribet mau bikin warung dipalakin ormas mau jadi ajar didik gaji culun mau kerja informal karena minim akses garuk pol pp mau jadi pegawai pabrik dan pt sedikit lihat poin 1 kaburajadulu,"mau,bikin,pabrik,regulasi,gak,jelas,minim,infra,dan,birokrasi,ribet,mau,bikin,warung,dipalakin,ormas,mau,jadi,ajar,didik,gaji,culun,mau,kerja,informal,karena,minim,akses,garuk,pol,pp,mau,jadi,pegawai,pabrik,dan,pt,sedikit,lihat,poin,1,kaburajadulu",0
KaburAjaDulu,2025-04-06T04:10:14.000Z,ini gak lucu sih menurut gue  makin bikin pengen #kaburajadulu  politisi kok kaya gitu dah  terus banyak juga yang setuju  wkwk  this country is beyond help,"ini, gak, lucu, sih, menurut, gue, makin, bikin, pengen, #, kaburajadulu, politisi, kok, kaya, gitu, dah, terus, banyak, juga, yang, setuju, wkwk, this, country, is, beyond, help","gak, lucu, sih, gue, bikin, pengen, #, kaburajadulu, politisi, kaya, gitu, dah, setuju, wkwk, this, country, is, beyond, help",ini gak lucu sih turut gue makin bikin ken kaburajadulu politis kok kaya gitu dah terus banyak juga yang tuju wkwk this country is beyond help,"ini,gak,lucu,sih,turut,gue,makin,bikin,ken,kaburajadulu,politis,kok,kaya,gitu,dah,terus,banyak,juga,yang,tuju,wkwk,this,country,is,beyond,help",0
KaburAjaDulu,2025-04-06T03:57:44.000Z,kenapa gue WNI?,"kenapa, gue, WNI, ?","gue, WNI, ?",kenapa gue wni,"kenapa,gue,wni",0
KaburAjaDulu,2025-04-06T03:57:31.000Z,jadi pengen #kaburajadulu ke negara yang gak kebanyakan gimmick hari-harian,"jadi, pengen, #, kaburajadulu, ke, negara, yang, gak, kebanyakan, gimmick, hari-harian","pengen, #, kaburajadulu, negara, gak, kebanyakan, gimmick, hari-harian",jadi ken kaburajadulu ke negara yang gak banyak gimmick hari,"jadi,ken,kaburajadulu,ke,negara,yang,gak,banyak,gimmick,hari",0
KaburAjaDulu,2025-04-06T03:56:49.000Z,jadi pengen #kaburajadulu ke negara yang ormas orang sipilnya gak doyan cosplay aparat/tentara2an,"jadi, pengen, #, kaburajadulu, ke, negara, yang, ormas, orang, sipilnya, gak, doyan, cosplay, aparat/tentara2an","pengen, #, kaburajadulu, negara, ormas, orang, sipilnya, gak, doyan, cosplay, aparat/tentara2an",jadi ken kaburajadulu ke negara yang ormas orang sipil gak doyan cosplay aparat tentara2an,"jadi,ken,kaburajadulu,ke,negara,yang,ormas,orang,sipil,gak,doyan,cosplay,aparat,tentara2an",0
KaburAjaDulu,2025-03-09T14:39:49.000Z,Makin pengen #KaburAjaDulu,"Makin, pengen, #, KaburAjaDulu","pengen, #, KaburAjaDulu",makin ken kaburajadulu,"makin,ken,kaburajadulu",1
KaburAjaDulu,2025-03-09T14:37:36.000Z,Minyak goreng aja takarannya dimanipulasi dan kok baru rame sekarang bener2 membingungkan  lebih bingung lagi kalo gak kepengen #KaburAjaDulu,"Minyak, goreng, aja, takarannya, dimanipulasi, dan, kok, baru, rame, sekarang, bener2, membingungkan, lebih, bingung, lagi, kalo, gak, kepengen, #, KaburAjaDulu","Minyak, goreng, aja, takarannya, dimanipulasi, rame, bener2, membingungkan, bingung, kalo, gak, kepengen, #, KaburAjaDulu",minyak goreng aja takar manipulasi dan kok baru rame sekarang bener2 bingung lebih bingung lagi kalo gak ken kaburajadulu,"minyak,goreng,aja,takar,manipulasi,dan,kok,baru,rame,sekarang,bener2,bingung,lebih,bingung,lagi,kalo,gak,ken,kaburajadulu",0
KaburAjaDulu,2025-03-03T08:46:46.000Z,"Kemaren ngobrol sama temen yg hidup dgn kanker payudara. Per Februari, salah satu obat injeksinya (avestrant) sudah tidak dicover BPJS :)  Harga satu dosisnya sekitar 3jt, dia harus 2x dosis sekali injeksi, 6jt gak dicover BPJS.","Kemaren, ngobrol, sama, temen, yg, hidup, dgn, kanker, payudara, ., Per, Februari, ,, salah, satu, obat, injeksinya, (, avestrant, ), sudah, tidak, dicover, BPJS, :, ), Harga, satu, dosisnya, sekitar, 3jt, ,, dia, harus, 2x, dosis, sekali, injeksi, ,, 6jt, gak, dicover, BPJS, .","Kemaren, ngobrol, temen, yg, hidup, dgn, kanker, payudara, ., Februari, ,, salah, obat, injeksinya, (, avestrant, ), dicover, BPJS, :, ), Harga, dosisnya, 3jt, ,, 2x, dosis, injeksi, ,, 6jt, gak, dicover, BPJS, .",kemaren ngobrol sama temen yg hidup dgn kanker payudara per februari salah satu obat injeksi avestrant sudah tidak dicover bpjs harga satu dosis sekitar 3jt dia harus 2x dosis sekali injeksi 6jt gak dicover bpjs,"kemaren,ngobrol,sama,temen,yg,hidup,dgn,kanker,payudara,per,februari,salah,satu,obat,injeksi,avestrant,sudah,tidak,dicover,bpjs,harga,satu,dosis,sekitar,3jt,dia,harus,2x,dosis,sekali,injeksi,6jt,gak,dicover,bpjs",0
KaburAjaDulu,2025-03-04T22:38:44.000Z,salah satu alasan utama pengen #KaburAjaDulu,"salah, satu, alasan, utama, pengen, #, KaburAjaDulu","salah, alasan, utama, pengen, #, KaburAjaDulu",salah satu alas utama ken kaburajadulu,"salah,satu,alas,utama,ken,kaburajadulu",1
KaburAjaDulu,2025-03-04T22:20:20.000Z,"Pengen #KaburAjaDulu ke tempat yang orang2nya kagak stress, kagak road rage, kagak dikit2 ngambekan kalo senggolan di jalan, kagak melanggar peraturan, kagak grasa grusu di jalan, kagak buru2 di jalan, kagak ngerokok sambil nyetir","Pengen, #, KaburAjaDulu, ke, tempat, yang, orang2nya, kagak, stress, ,, kagak, road, rage, ,, kagak, dikit2, ngambekan, kalo, senggolan, di, jalan, ,, kagak, melanggar, peraturan, ,, kagak, grasa, grusu, di, jalan, ,, kagak, buru2, di, jalan, ,, kagak, ngerokok, sambil, nyetir","Pengen, #, KaburAjaDulu, orang2nya, kagak, stress, ,, kagak, road, rage, ,, kagak, dikit2, ngambekan, kalo, senggolan, jalan, ,, kagak, melanggar, peraturan, ,, kagak, grasa, grusu, jalan, ,, kagak, buru2, jalan, ,, kagak, ngerokok, nyetir",ken kaburajadulu ke tempat yang orang2nya kagak stress kagak road rage kagak dikit2 ngambekan kalo senggol di jalan kagak langgar atur kagak grasa grusu di jalan kagak buru2 di jalan kagak ngerokok sambil nyetir,"ken,kaburajadulu,ke,tempat,yang,orang2nya,kagak,stress,kagak,road,rage,kagak,dikit2,ngambekan,kalo,senggol,di,jalan,kagak,langgar,atur,kagak,grasa,grusu,di,jalan,kagak,buru2,di,jalan,kagak,ngerokok,sambil,nyetir",0
KaburAjaDulu,2025-03-04T22:18:44.000Z,semakin sulit kalau mau #KaburAjaDulu,"semakin, sulit, kalau, mau, #, KaburAjaDulu","sulit, #, KaburAjaDulu",makin sulit kalau mau kaburajadulu,"makin,sulit,kalau,mau,kaburajadulu",0
KaburAjaDulu,2025-03-04T22:18:06.000Z,Pengen #KaburAjaDulu ke tempat yang bebas banjir gak sih?  Yang pemerintahnya ngejaga kawasan yang harusnya jadi resapan air tetap steril dari pembangunan   Yang rakyatnya gak buang sampah sembarangan  Yang pengusahanya gak menyuap govt official  Yang govt officialnya gak korup,"Pengen, #, KaburAjaDulu, ke, tempat, yang, bebas, banjir, gak, sih, ?, Yang, pemerintahnya, ngejaga, kawasan, yang, harusnya, jadi, resapan, air, tetap, steril, dari, pembangunan, Yang, rakyatnya, gak, buang, sampah, sembarangan, Yang, pengusahanya, gak, menyuap, govt, official, Yang, govt, officialnya, gak, korup","Pengen, #, KaburAjaDulu, bebas, banjir, gak, sih, ?, pemerintahnya, ngejaga, kawasan, resapan, air, steril, pembangunan, rakyatnya, gak, buang, sampah, sembarangan, pengusahanya, gak, menyuap, govt, official, govt, officialnya, gak, korup",ken kaburajadulu ke tempat yang bebas banjir gak sih yang perintah ngejaga kawasan yang harus jadi resap air tetap steril dari bangun yang rakyat gak buang sampah sembarang yang usaha gak suap govt official yang govt officialnya gak korup,"ken,kaburajadulu,ke,tempat,yang,bebas,banjir,gak,sih,yang,perintah,ngejaga,kawasan,yang,harus,jadi,resap,air,tetap,steril,dari,bangun,yang,rakyat,gak,buang,sampah,sembarang,yang,usaha,gak,suap,govt,official,yang,govt,officialnya,gak,korup",0
KaburAjaDulu,2025-03-04T07:13:47.000Z, | mahal banget gak sih,"|, mahal, banget, gak, sih","|, mahal, banget, gak, sih",mahal banget gak sih,"mahal,banget,gak,sih",0
KaburAjaDulu,2025-03-04T15:02:03.000Z,Mau #KaburAjaDulu dipersulit gini gimana coba? https://x.com/BudiBukanIntel/BudiBukanIntel/status/1896917422323663325…,"Mau, #, KaburAjaDulu, dipersulit, gini, gimana, coba, ?, https, :, //x.com/BudiBukanIntel/BudiBukanIntel/status/1896917422323663325…","#, KaburAjaDulu, dipersulit, gini, gimana, coba, ?, https, :, //x.com/BudiBukanIntel/BudiBukanIntel/status/1896917422323663325…",mau kaburajadulu sulit gin gimana coba https x com budibukanintel budibukanintel status 1896917422323663325,"mau,kaburajadulu,sulit,gin,gimana,coba,https,x,com,budibukanintel,budibukanintel,status,1896917422323663325",0
KaburAjaDulu,2025-03-04T04:40:59.000Z,Pengen #KaburAjaDulu ke negara yang gak tiap hari ada berita buruk soal kebodohan di negaranya,"Pengen, #, KaburAjaDulu, ke, negara, yang, gak, tiap, hari, ada, berita, buruk, soal, kebodohan, di, negaranya","Pengen, #, KaburAjaDulu, negara, gak, berita, buruk, kebodohan, negaranya",ken kaburajadulu ke negara yang gak tiap hari ada berita buruk soal bodoh di negara,"ken,kaburajadulu,ke,negara,yang,gak,tiap,hari,ada,berita,buruk,soal,bodoh,di,negara",0
KaburAjaDulu,2025-03-02T09:10:05.000Z,Buat yang missed dengerin Webinar #KaburAjaDulu gw ama  @lwastuargo   kemarin -> bisa dengerin rekamannya di sini -> https://goakal.com/lwastuargo/kaburajadulu….  Termasuk di dalemnya ada 2 tipe strategy buat bisa ke kabur ke Ameriki => gabung 88rising kaya Niky trus pake visa O1 atau nikah ama bule,"Buat, yang, missed, dengerin, Webinar, #, KaburAjaDulu, gw, ama, @, lwastuargo, kemarin, -, >, bisa, dengerin, rekamannya, di, sini, -, >, https, :, //goakal.com/lwastuargo/kaburajadulu…, ., Termasuk, di, dalemnya, ada, 2, tipe, strategy, buat, bisa, ke, kabur, ke, Ameriki, =, >, gabung, 88rising, kaya, Niky, trus, pake, visa, O1, atau, nikah, ama, bule","missed, dengerin, Webinar, #, KaburAjaDulu, gw, ama, @, lwastuargo, kemarin, -, >, dengerin, rekamannya, -, >, https, :, //goakal.com/lwastuargo/kaburajadulu…, ., dalemnya, 2, tipe, strategy, kabur, Ameriki, =, >, gabung, 88rising, kaya, Niky, trus, pake, visa, O1, nikah, ama, bule",buat yang missed dengerin webinar kaburajadulu gw ama lwastuargo kemarin - bisa dengerin rekam di sini - https goakal com lwastuargo kaburajadulu masuk di dalem ada 2 tipe strategy buat bisa ke kabur ke ameriki gabung 88rising kaya niky trus pake visa o1 atau nikah ama bule,"buat,yang,missed,dengerin,webinar,kaburajadulu,gw,ama,lwastuargo,kemarin,-,bisa,dengerin,rekam,di,sini,-,https,goakal,com,lwastuargo,kaburajadulu,masuk,di,dalem,ada,2,tipe,strategy,buat,bisa,ke,kabur,ke,ameriki,gabung,88rising,kaya,niky,trus,pake,visa,o1,atau,nikah,ama,bule",0
KaburAjaDulu,2025-02-21T07:24:54.000Z,wajah2 #KaburAjaDulu setelah lulus,"wajah2, #, KaburAjaDulu, setelah, lulus","wajah2, #, KaburAjaDulu, lulus",wajah2 kaburajadulu telah lulus,"wajah2,kaburajadulu,telah,lulus",1
KaburAjaDulu,2025-02-21T07:23:24.000Z,Kalian gak pengen #KaburDuluAja ke negara yang persyaratan masuk PNS nya gak pake ukuran tinggi badan?,"Kalian, gak, pengen, #, KaburDuluAja, ke, negara, yang, persyaratan, masuk, PNS, nya, gak, pake, ukuran, tinggi, badan, ?","gak, pengen, #, KaburDuluAja, negara, persyaratan, masuk, PNS, nya, gak, pake, ukuran, badan, ?",kalian gak ken kaburduluaja ke negara yang syarat masuk pns nya gak pake ukur tinggi badan,"kalian,gak,ken,kaburduluaja,ke,negara,yang,syarat,masuk,pns,nya,gak,pake,ukur,tinggi,badan",0
KaburAjaDulu,2025-02-21T07:15:55.000Z,Keren nih from Cimahi to London. Congrats  @gedearyarp    #KaburAjaDulu ,"Keren, nih, from, Cimahi, to, London, ., Congrats, @, gedearyarp, #, KaburAjaDulu","Keren, nih, from, Cimahi, to, London, ., Congrats, @, gedearyarp, #, KaburAjaDulu",keren nih from cimahi to london congrats gedearyarp kaburajadulu,"keren,nih,from,cimahi,to,london,congrats,gedearyarp,kaburajadulu",1
KaburAjaDulu,2025-02-21T03:42:30.000Z,"Pernah terima pasien yg  datang sambil bawa anak kecil yg nangis-nangis.  Pasiennya cuma bilang “saya ditonjok suami saya, tolong diperiksa dok takutnya rahang saya geser tadi bunyi keras”  Damn, dan bagian terberatnya harus edukasi pasiennya, ga bisa pake bpjs","Pernah, terima, pasien, yg, datang, sambil, bawa, anak, kecil, yg, nangis-nangis, ., Pasiennya, cuma, bilang, “, saya, ditonjok, suami, saya, ,, tolong, diperiksa, dok, takutnya, rahang, saya, geser, tadi, bunyi, keras, ”, Damn, ,, dan, bagian, terberatnya, harus, edukasi, pasiennya, ,, ga, bisa, pake, bpjs","terima, pasien, yg, bawa, anak, yg, nangis-nangis, ., Pasiennya, bilang, “, ditonjok, suami, ,, tolong, diperiksa, dok, takutnya, rahang, geser, bunyi, keras, ”, Damn, ,, terberatnya, edukasi, pasiennya, ,, ga, pake, bpjs",pernah terima pasien yg datang sambil bawa anak kecil yg nang pasien cuma bilang saya tonjok suami saya tolong periksa dok takut rahang saya geser tadi bunyi keras damn dan bagi berat harus edukasi pasien ga bisa pake bpjs,"pernah,terima,pasien,yg,datang,sambil,bawa,anak,kecil,yg,nang,pasien,cuma,bilang,saya,tonjok,suami,saya,tolong,periksa,dok,takut,rahang,saya,geser,tadi,bunyi,keras,damn,dan,bagi,berat,harus,edukasi,pasien,ga,bisa,pake,bpjs",0
KaburAjaDulu,2025-02-21T05:58:57.000Z,yuk #KaburDuluAja cari negara yang stok paracetamolnya selalu aman,"yuk, #, KaburDuluAja, cari, negara, yang, stok, paracetamolnya, selalu, aman","yuk, #, KaburDuluAja, cari, negara, stok, paracetamolnya, aman",yuk kaburduluaja cari negara yang stok paracetamolnya selalu aman,"yuk,kaburduluaja,cari,negara,yang,stok,paracetamolnya,selalu,aman",0
KaburAjaDulu,2025-02-21T03:11:46.000Z,"gue lumayan percaya sama mekanisme pasar  kenapa sih tagar #KaburAjaDulu muncul? salah satunya karena SDM di Indonesia merasa tinggal dan kerja disini udah gak ,menarik lagi sehingga alamiah berniat untuk kabur (terlepas berhasil atau nggak)  wajar2 aja menurut gue","gue, lumayan, percaya, sama, mekanisme, pasar, kenapa, sih, tagar, #, KaburAjaDulu, muncul, ?, salah, satunya, karena, SDM, di, Indonesia, merasa, tinggal, dan, kerja, disini, udah, gak, ,, menarik, lagi, sehingga, alamiah, berniat, untuk, kabur, (, terlepas, berhasil, atau, nggak, ), wajar2, aja, menurut, gue","gue, lumayan, percaya, mekanisme, pasar, sih, tagar, #, KaburAjaDulu, muncul, ?, salah, satunya, SDM, Indonesia, tinggal, kerja, udah, gak, ,, menarik, alamiah, berniat, kabur, (, terlepas, berhasil, nggak, ), wajar2, aja, gue",gue lumayan percaya sama mekanisme pasar kenapa sih tagar kaburajadulu muncul salah satu karena sdm di indonesia rasa tinggal dan kerja sini udah gak tarik lagi sehingga alamiah niat untuk kabur lepas hasil atau nggak wajar2 aja turut gue,"gue,lumayan,percaya,sama,mekanisme,pasar,kenapa,sih,tagar,kaburajadulu,muncul,salah,satu,karena,sdm,di,indonesia,rasa,tinggal,dan,kerja,sini,udah,gak,tarik,lagi,sehingga,alamiah,niat,untuk,kabur,lepas,hasil,atau,nggak,wajar2,aja,turut,gue",0
KaburAjaDulu,2025-02-21T03:12:48.000Z,toh banyak juga orang asing pengen tinggal disini (Bali)  fine2 aja  Raffi ahmad mau bikin tagar positive vibe ya silakan2 aja   bebas2 aja,"toh, banyak, juga, orang, asing, pengen, tinggal, disini, (, Bali, ), fine2, aja, Raffi, ahmad, mau, bikin, tagar, positive, vibe, ya, silakan2, aja, bebas2, aja","orang, asing, pengen, tinggal, (, Bali, ), fine2, aja, Raffi, ahmad, bikin, tagar, positive, vibe, ya, silakan2, aja, bebas2, aja",toh banyak juga orang asing ken tinggal sini bal fine2 aja raffi ahmad mau bikin tagar positive vibe ya silakan2 aja bebas2 aja,"toh,banyak,juga,orang,asing,ken,tinggal,sini,bal,fine2,aja,raffi,ahmad,mau,bikin,tagar,positive,vibe,ya,silakan2,aja,bebas2,aja",0
KaburAjaDulu,2025-02-20T17:22:29.000Z,Jadi kepikiran pengen #KaburAjaDulu ke negara yang sektor riilnya kuat dan minim tutup pabrik dimana sektor informalnya minim tapi sektor formalnya kuat,"Jadi, kepikiran, pengen, #, KaburAjaDulu, ke, negara, yang, sektor, riilnya, kuat, dan, minim, tutup, pabrik, dimana, sektor, informalnya, minim, tapi, sektor, formalnya, kuat","kepikiran, pengen, #, KaburAjaDulu, negara, sektor, riilnya, kuat, minim, tutup, pabrik, dimana, sektor, informalnya, minim, sektor, formalnya, kuat",jadi pikir ken kaburajadulu ke negara yang sektor riil kuat dan minim tutup pabrik mana sektor informal minim tapi sektor formal kuat,"jadi,pikir,ken,kaburajadulu,ke,negara,yang,sektor,riil,kuat,dan,minim,tutup,pabrik,mana,sektor,informal,minim,tapi,sektor,formal,kuat",0
KaburAjaDulu,2025-02-18T16:08:20.000Z,"yuk kita #KaburAjaDulu cari negara yang tanam cabe hari ini, besok panen","yuk, kita, #, KaburAjaDulu, cari, negara, yang, tanam, cabe, hari, ini, ,, besok, panen","yuk, #, KaburAjaDulu, cari, negara, tanam, cabe, ,, besok, panen",yuk kita kaburajadulu cari negara yang tanam cabe hari ini besok panen,"yuk,kita,kaburajadulu,cari,negara,yang,tanam,cabe,hari,ini,besok,panen",0
KaburAjaDulu,2025-02-18T05:10:59.000Z,Sebuah catatan untuk yang tertarik #KaburAjaDulu ke Jepang menggunakan visa gijinkoku* (Engineer/Specialist in Humanities/International Services).  *hanya bisa didapatkan oleh lulusan S1 atau experienced >10 tahun di bidang kerja yang sama.,"Sebuah, catatan, untuk, yang, tertarik, #, KaburAjaDulu, ke, Jepang, menggunakan, visa, gijinkoku, *, (, Engineer/Specialist, in, Humanities/International, Services, ), ., *, hanya, bisa, didapatkan, oleh, lulusan, S1, atau, experienced, >, 10, tahun, di, bidang, kerja, yang, sama, .","catatan, tertarik, #, KaburAjaDulu, Jepang, visa, gijinkoku, *, (, Engineer/Specialist, in, Humanities/International, Services, ), ., *, didapatkan, lulusan, S1, experienced, >, 10, bidang, kerja, .",buah catat untuk yang tarik kaburajadulu ke jepang guna visa gijinkoku engineer specialist in humanities international services hanya bisa dapat oleh lulus s1 atau experienced 10 tahun di bidang kerja yang sama,"buah,catat,untuk,yang,tarik,kaburajadulu,ke,jepang,guna,visa,gijinkoku,engineer,specialist,in,humanities,international,services,hanya,bisa,dapat,oleh,lulus,s1,atau,experienced,10,tahun,di,bidang,kerja,yang,sama",0
KaburAjaDulu,2025-02-17T08:28:15.000Z,Bosen di INDONESIA? Mau kabur? berikut TUTORIAL KABUR KE JEPANG  ikut meramaikan #KaburAjaDulu #IndonesiaGelap,"Bosen, di, INDONESIA, ?, Mau, kabur, ?, berikut, TUTORIAL, KABUR, KE, JEPANG, ikut, meramaikan, #, KaburAjaDulu, #, IndonesiaGelap","Bosen, INDONESIA, ?, kabur, ?, TUTORIAL, KABUR, JEPANG, meramaikan, #, KaburAjaDulu, #, IndonesiaGelap",bosen di indonesia mau kabur ikut tutorial kabur ke jepang ikut ramai kaburajadulu indonesiagelap,"bosen,di,indonesia,mau,kabur,ikut,tutorial,kabur,ke,jepang,ikut,ramai,kaburajadulu,indonesiagelap",0
KaburAjaDulu,2025-02-17T14:52:21.000Z,ya udah lah yok,"ya, udah, lah, yok","ya, udah, yok",ya udah lah yok,"ya,udah,lah,yok",0
KaburAjaDulu,2025-02-17T14:26:39.000Z,#IndonesiaGelap ?? ya udah deh #KaburAjaDulu,"#, IndonesiaGelap, ?, ?, ya, udah, deh, #, KaburAjaDulu","#, IndonesiaGelap, ?, ?, ya, udah, deh, #, KaburAjaDulu",indonesiagelap ya udah deh kaburajadulu,"indonesiagelap,ya,udah,deh,kaburajadulu",1
KaburAjaDulu,2025-02-17T14:25:19.000Z,mantap,mantap,mantap,mantap,mantap,1
KaburAjaDulu,2025-02-17T14:12:35.000Z,mantap bang,"mantap, bang","mantap, bang",mantap bang,"mantap,bang",1
KaburAjaDulu,2025-02-17T09:58:53.000Z,Ini juga yg bikin gw mau ikutan kabur. Pindah usaha .,"Ini, juga, yg, bikin, gw, mau, ikutan, kabur, ., Pindah, usaha, .","yg, bikin, gw, ikutan, kabur, ., Pindah, usaha, .",ini juga yg bikin gw mau ikut kabur pindah usaha,"ini,juga,yg,bikin,gw,mau,ikut,kabur,pindah,usaha",0
KaburAjaDulu,2025-02-17T05:34:05.000Z,"Aku dulu guilty juga crab mentality, apalagi pas kuliah & baru lulus  Sekian belas tahun lalu pas #KaburAjaDulu ke Belanda, aku ketemu kolega yang mantra hidupnya genuinely ""be happy for someone else's success""  Like, matanya benar2 berbinar2 & senyum bangga gitu kalau kita lagi","Aku, dulu, guilty, juga, crab, mentality, ,, apalagi, pas, kuliah, &, baru, lulus, Sekian, belas, tahun, lalu, pas, #, KaburAjaDulu, ke, Belanda, ,, aku, ketemu, kolega, yang, mantra, hidupnya, genuinely, ``, be, happy, for, someone, else, 's, success, '', Like, ,, matanya, benar2, berbinar2, &, senyum, bangga, gitu, kalau, kita, lagi","guilty, crab, mentality, ,, pas, kuliah, &, lulus, Sekian, belas, pas, #, KaburAjaDulu, Belanda, ,, ketemu, kolega, mantra, hidupnya, genuinely, ``, be, happy, for, someone, else, 's, success, '', Like, ,, matanya, benar2, berbinar2, &, senyum, bangga, gitu",aku dulu guilty juga crab mentality apalagi pas kuliah baru lulus sekian belas tahun lalu pas kaburajadulu ke belanda aku ketemu kolega yang mantra hidup genuinely be happy for someone else s success like mata benar2 berbinar2 senyum bangga gitu kalau kita lagi,"aku,dulu,guilty,juga,crab,mentality,apalagi,pas,kuliah,baru,lulus,sekian,belas,tahun,lalu,pas,kaburajadulu,ke,belanda,aku,ketemu,kolega,yang,mantra,hidup,genuinely,be,happy,for,someone,else,s,success,like,mata,benar2,berbinar2,senyum,bangga,gitu,kalau,kita,lagi",0
KaburAjaDulu,2025-02-16T10:57:12.000Z,I hope this won't stop you from fleeting the country to look for a better life  do it legally and you'll be fine  #KaburAjaDulu,"I, hope, this, wo, n't, stop, you, from, fleeting, the, country, to, look, for, a, better, life, do, it, legally, and, you, 'll, be, fine, #, KaburAjaDulu","I, hope, this, wo, n't, stop, you, from, fleeting, the, country, to, look, for, a, better, life, do, it, legally, and, you, 'll, be, fine, #, KaburAjaDulu",i hope this won t stop you from fleeting the country to look for a better life do it legally and you ll be fine kaburajadulu,"i,hope,this,won,t,stop,you,from,fleeting,the,country,to,look,for,a,better,life,do,it,legally,and,you,ll,be,fine,kaburajadulu",1
KaburAjaDulu,2025-02-16T05:06:05.000Z,"banyak juga mentionan ads dari buzzer judi online, gue blok2in semua  salah satu lagi alasan pengen #KaburAjaDulu   Judi online yang dampaknya sistemik kok kaya gak bisa diberesin  ya udah lah mungkin emang #GaKetolong kali ye","banyak, juga, mentionan, ads, dari, buzzer, judi, online, ,, gue, blok2in, semua, salah, satu, lagi, alasan, pengen, #, KaburAjaDulu, Judi, online, yang, dampaknya, sistemik, kok, kaya, gak, bisa, diberesin, ya, udah, lah, mungkin, emang, #, GaKetolong, kali, ye","mentionan, ads, buzzer, judi, online, ,, gue, blok2in, salah, alasan, pengen, #, KaburAjaDulu, Judi, online, dampaknya, sistemik, kaya, gak, diberesin, ya, udah, emang, #, GaKetolong, kali, ye",banyak juga mentionan ads dari buzzer judi online gue blok2in semua salah satu lagi alas ken kaburajadulu judi online yang dampak sistemik kok kaya gak bisa resin ya udah lah mungkin emang gaketolong kali ye,"banyak,juga,mentionan,ads,dari,buzzer,judi,online,gue,blok2in,semua,salah,satu,lagi,alas,ken,kaburajadulu,judi,online,yang,dampak,sistemik,kok,kaya,gak,bisa,resin,ya,udah,lah,mungkin,emang,gaketolong,kali,ye",0
KaburAjaDulu,2025-02-16T05:04:00.000Z,yang udah cape kena bau pengguna transum gara2 AC gak dingin atau rusak boleh coba untuk #KaburAjaDulu ke negara yang sepanjang tahun dingin supaya relatif terhindar dari bau walaupun cuma relatif yang penting hidup jadi lebih baik,"yang, udah, cape, kena, bau, pengguna, transum, gara2, AC, gak, dingin, atau, rusak, boleh, coba, untuk, #, KaburAjaDulu, ke, negara, yang, sepanjang, tahun, dingin, supaya, relatif, terhindar, dari, bau, walaupun, cuma, relatif, yang, penting, hidup, jadi, lebih, baik","udah, cape, kena, bau, pengguna, transum, gara2, AC, gak, dingin, rusak, coba, #, KaburAjaDulu, negara, dingin, relatif, terhindar, bau, relatif, hidup",yang udah cape kena bau guna transum gara2 ac gak dingin atau rusak boleh coba untuk kaburajadulu ke negara yang panjang tahun dingin supaya relatif hindar dari bau walaupun cuma relatif yang penting hidup jadi lebih baik,"yang,udah,cape,kena,bau,guna,transum,gara2,ac,gak,dingin,atau,rusak,boleh,coba,untuk,kaburajadulu,ke,negara,yang,panjang,tahun,dingin,supaya,relatif,hindar,dari,bau,walaupun,cuma,relatif,yang,penting,hidup,jadi,lebih,baik",0
KaburAjaDulu,2025-02-16T03:54:15.000Z,"yang bikin lagu berani banget, gak kepikiran #KaburAjaDulu ??","yang, bikin, lagu, berani, banget, ,, gak, kepikiran, #, KaburAjaDulu, ?, ?","bikin, lagu, berani, banget, ,, gak, kepikiran, #, KaburAjaDulu, ?, ?",yang bikin lagu berani banget gak pikir kaburajadulu,"yang,bikin,lagu,berani,banget,gak,pikir,kaburajadulu",0
